{
  "format": "adapter-registry",
  "schemaVersion": 3,
  "namespace": "flux2-klein",
  "title": "FLUX.2 Klein adapters",
  "adapters": [
    {
      "id": "refcontrol-pose",
      "title": "RefControl Pose",
      "kind": "ic",
      "format": "bfl-fused",
      "baseModels": [
        "flux2-klein-4b"
      ],
      "capabilities": [
        "imageEdit"
      ],
      "source": {
        "host": "huggingface",
        "repo": "xocialize/refcontrol-FLUX.2-klein-4B-pose-lora",
        "revision": "b2b0edf2622f2abd980bf868441149d71b3eb7b0",
        "file": "refcontrol-pose-klein-4b.safetensors",
        "sha256": "f9880f9070576ff1603c0988ed2afc9957deb0d7dd7c52cf15decbd4087f1339",
        "bytes": 92426792,
        "gated": false,
        "hashFrom": "hub"
      },
      "license": "Apache-2.0",
      "licenseTerms": {
        "commercialUse": "allowed",
        "gated": false
      },
      "defaultStrength": 1.0,
      "conditioning": [
        {
          "role": "pose",
          "media": "image",
          "required": true,
          "ingest": "openpose-skeleton",
          "note": "OpenPose-style skeleton = target pose. Order is load-bearing."
        },
        {
          "role": "reference",
          "media": "image",
          "required": true,
          "ingest": "raw",
          "note": "Subject reference image. Order is load-bearing."
        }
      ],
      "status": "verified",
      "clearance": {
        "flux2-klein-4b": {
          "level": "mechanical"
        }
      },
      "trigger": "refcontrol",
      "promptTemplate": "apply pose from image 1 with reference from image 2",
      "weights": {
        "rank": 32,
        "alpha": 32
      },
      "verification": {
        "headerDialect": "bfl-fused",
        "rank": 32,
        "alpha": 32,
        "tensors": 160,
        "doubleTargets": 60,
        "singleTargets": 40,
        "dtypes": [
          "bf16",
          "int4"
        ],
        "checkpoint": "v2-step3500",
        "gate": "applicator-validated"
      }
    },
    {
      "id": "consistence-edit",
      "title": "Consistence Edit",
      "kind": "plain",
      "format": "diffusers-split",
      "baseModels": [
        "flux2-klein-4b"
      ],
      "capabilities": [
        "imageEdit"
      ],
      "source": {
        "host": "huggingface",
        "repo": "xocialize/consistence-edit-FLUX.2-klein-4B-lora",
        "revision": "f043b846a356529a6b0c269945f0888522064490",
        "file": "f2k_4B_consist_20260314.safetensors",
        "sha256": "bed1e7e8747bc4572a20a7fcef436e82cfbfa5430d0162eda713b55d7a3c7ce4",
        "bytes": 385379872,
        "gated": false,
        "hashFrom": "hub",
        "upstream": "https://civitai.com/models/1939453?modelVersionId=2771678"
      },
      "license": "Apache-2.0",
      "licenseTerms": {
        "commercialUse": "allowed",
        "gated": false,
        "url": "https://huggingface.co/xocialize/consistence-edit-FLUX.2-klein-4B-lora/blob/f043b846a356529a6b0c269945f0888522064490/LICENSE",
        "notice": "Keep this repo's NOTICE file (the original author's attribution) with any redistributed copy: https://huggingface.co/xocialize/consistence-edit-FLUX.2-klein-4B-lora/blob/f043b846a356529a6b0c269945f0888522064490/NOTICE"
      },
      "defaultStrength": 0.6,
      "status": "verified",
      "clearance": {
        "flux2-klein-4b": {
          "level": "mechanical"
        }
      },
      "trigger": "transform the image to realistic photograph. add realistic details to the corrupted image. restore high frequence details from the corrupted image.",
      "promptTemplate": "transform the image to realistic photograph. add realistic details to the corrupted image. restore high frequence details from the corrupted image.",
      "weights": {
        "rank": 128
      },
      "verification": {
        "headerDialect": "diffusers-split",
        "rank": 128,
        "tensors": 200,
        "doubleTargets": 60,
        "singleTargets": 40,
        "dtypes": [
          "bf16"
        ],
        "checkpoint": "20260314",
        "gate": "applicator-smoke-100-targets"
      }
    },
    {
      "id": "object-remove",
      "title": "Object Removal",
      "kind": "plain",
      "format": "bfl-fused-peft",
      "baseModels": [
        "flux2-klein-4b"
      ],
      "capabilities": [
        "imageEdit"
      ],
      "source": {
        "host": "huggingface",
        "repo": "xocialize/object-remove-FLUX.2-klein-4B-lora",
        "revision": "342dddc056a973197335cda95e3aad090d1581d2",
        "file": "flux-object-remove-lora.safetensors",
        "sha256": "70ceea34a8bcd6e7d0249ba26bb59a3cd8b8c38745fab65a3eb112a5c13e3c69",
        "bytes": 58441728,
        "gated": false,
        "hashFrom": "hub",
        "upstream": "https://huggingface.co/fal/flux-2-klein-4B-object-remove-lora"
      },
      "license": "Apache-2.0",
      "licenseTerms": {
        "commercialUse": "allowed",
        "gated": false,
        "url": "https://huggingface.co/xocialize/object-remove-FLUX.2-klein-4B-lora/blob/342dddc056a973197335cda95e3aad090d1581d2/LICENSE",
        "notice": "Keep this repo's NOTICE file (the original author's attribution) with any redistributed copy: https://huggingface.co/xocialize/object-remove-FLUX.2-klein-4B-lora/blob/342dddc056a973197335cda95e3aad090d1581d2/NOTICE"
      },
      "defaultStrength": 1.1,
      "status": "verified",
      "clearance": {
        "flux2-klein-4b": {
          "level": "mechanical"
        }
      },
      "trigger": "Remove the highlighted object from the scene",
      "promptTemplate": "Remove the highlighted object from the scene",
      "weights": {
        "rank": 16
      },
      "verification": {
        "headerDialect": "bfl-fused-peft",
        "rank": 16,
        "tensors": 136,
        "doubleTargets": 40,
        "singleTargets": 40,
        "dtypes": [
          "f32"
        ],
        "checkpoint": "fal-2026-01",
        "gate": "applicator-validated-80-targets"
      }
    },
    {
      "id": "background-remove",
      "title": "Background Removal",
      "kind": "plain",
      "format": "bfl-fused-peft",
      "baseModels": [
        "flux2-klein-4b"
      ],
      "capabilities": [
        "imageEdit"
      ],
      "source": {
        "host": "huggingface",
        "repo": "xocialize/background-remove-FLUX.2-klein-4B-lora",
        "revision": "10f38b4af9de00f1a3b177e44d0aaec30d842af6",
        "file": "flux-background-remove-lora.safetensors",
        "sha256": "79d8cd4a5ea67c196b173aeb7c751bcfffc79823993b2a033107d4a8db68bcea",
        "bytes": 76039072,
        "gated": false,
        "hashFrom": "hub",
        "upstream": "https://huggingface.co/fal/flux-2-klein-4B-background-remove-lora"
      },
      "license": "Apache-2.0",
      "licenseTerms": {
        "commercialUse": "allowed",
        "gated": false,
        "url": "https://huggingface.co/xocialize/background-remove-FLUX.2-klein-4B-lora/blob/10f38b4af9de00f1a3b177e44d0aaec30d842af6/LICENSE",
        "notice": "Keep this repo's NOTICE file (the original author's attribution) with any redistributed copy: https://huggingface.co/xocialize/background-remove-FLUX.2-klein-4B-lora/blob/10f38b4af9de00f1a3b177e44d0aaec30d842af6/NOTICE"
      },
      "defaultStrength": 1.1,
      "status": "verified",
      "clearance": {
        "flux2-klein-4b": {
          "level": "mechanical"
        }
      },
      "trigger": "Remove the background from the image",
      "promptTemplate": "Remove the background from the image",
      "weights": {
        "rank": 16
      },
      "verification": {
        "headerDialect": "bfl-fused-peft",
        "rank": 16,
        "tensors": 136,
        "doubleTargets": 40,
        "singleTargets": 40,
        "dtypes": [
          "f32"
        ],
        "checkpoint": "fal-2026-01",
        "gate": "applicator-validated-80-targets"
      }
    },
    {
      "id": "outpaint",
      "title": "Outpaint (Green Screen)",
      "kind": "plain",
      "format": "bfl-fused-peft",
      "baseModels": [
        "flux2-klein-4b"
      ],
      "capabilities": [
        "imageEdit"
      ],
      "source": {
        "host": "huggingface",
        "repo": "xocialize/outpaint-FLUX.2-klein-4B-lora",
        "revision": "dafbfeeed5db940fd74cd9c0fb6981560e77d343",
        "file": "flux-outpaint-lora.safetensors",
        "sha256": "9623927f2471613e0c9d7810da3c39f0b277a448193b223ea3cee67d5750974a",
        "bytes": 76039072,
        "gated": false,
        "hashFrom": "hub",
        "upstream": "https://huggingface.co/fal/flux-2-klein-4B-outpaint-lora"
      },
      "license": "Apache-2.0",
      "licenseTerms": {
        "commercialUse": "allowed",
        "gated": false,
        "url": "https://huggingface.co/xocialize/outpaint-FLUX.2-klein-4B-lora/blob/dafbfeeed5db940fd74cd9c0fb6981560e77d343/LICENSE",
        "notice": "Keep this repo's NOTICE file (the original author's attribution) with any redistributed copy: https://huggingface.co/xocialize/outpaint-FLUX.2-klein-4B-lora/blob/dafbfeeed5db940fd74cd9c0fb6981560e77d343/NOTICE"
      },
      "defaultStrength": 1.1,
      "status": "verified",
      "clearance": {
        "flux2-klein-4b": {
          "level": "mechanical"
        }
      },
      "trigger": "Fill the green spaces according to the image",
      "promptTemplate": "Fill the green spaces according to the image",
      "weights": {
        "rank": 16
      },
      "verification": {
        "headerDialect": "bfl-fused-peft",
        "rank": 16,
        "tensors": 136,
        "doubleTargets": 40,
        "singleTargets": 40,
        "dtypes": [
          "f32"
        ],
        "checkpoint": "fal-2026-01",
        "gate": "applicator-validated-80-targets"
      }
    },
    {
      "id": "spritesheet",
      "title": "2x2 Sprite Sheet",
      "kind": "plain",
      "format": "bfl-fused-peft",
      "baseModels": [
        "flux2-klein-4b"
      ],
      "capabilities": [
        "imageEdit"